{
  "model": "gemini-1.5-pro",
  "contents": [
    {
      "role": "user",
      "parts": [
        {
          "text": "Summarize the last outage incident and mitigation steps."
        }
      ]
    }
  ],
  "tools": [],
  "stream": false,
  "systemInstruction": {
    "parts": [
      {
        "text": "Be concise and technical."
      }
    ]
  },
  "generationConfig": {
    "maxOutputTokens": 1024,
    "temperature": 0.4
  }
}